{
  "$schema": "https://json-schema.org/draft/2020-12/schema",
  "$id": "https://ytm-converter.local/schemas/weak-label-output.schema.json",
  "title": "EDM Weak Label Output",
  "description": "Conservative weak labels mapped strictly to taxonomy.yaml.",
  "type": "object",
  "additionalProperties": false,
  "required": [
    "schema_version",
    "taxonomy_version",
    "track_id",
    "status",
    "labels",
    "candidates",
    "uncertainty",
    "ignored_evidence"
  ],
  "properties": {
    "schema_version": {
      "const": "0.1.0"
    },
    "taxonomy_version": {
      "const": "0.1.0"
    },
    "track_id": {
      "type": "string",
      "minLength": 1
    },
    "status": {
      "type": "string",
      "enum": [
        "labeled",
        "uncertain",
        "out_of_scope"
      ]
    },
    "labels": {
      "type": "array",
      "maxItems": 2,
      "uniqueItems": true,
      "items": {
        "$ref": "#/$defs/label_result"
      },
      "description": "Accepted training labels only. Do not include derived parent labels."
    },
    "candidates": {
      "type": "array",
      "maxItems": 3,
      "uniqueItems": true,
      "items": {
        "$ref": "#/$defs/label_result"
      },
      "description": "Plausible but non-accepted labels for review."
    },
    "uncertainty": {
      "oneOf": [
        {
          "type": "null"
        },
        {
          "type": "object",
          "additionalProperties": false,
          "required": [
            "reason",
            "notes"
          ],
          "properties": {
            "reason": {
              "type": "string",
              "enum": [
                "insufficient_evidence",
                "conflicting_evidence",
                "boundary_ambiguous",
                "out_of_taxonomy",
                "not_edm",
                "other"
              ]
            },
            "notes": {
              "type": "string",
              "minLength": 1,
              "maxLength": 500
            }
          }
        }
      ]
    },
    "ignored_evidence": {
      "type": "array",
      "items": {
        "type": "object",
        "additionalProperties": false,
        "required": [
          "evidence_ref",
          "reason"
        ],
        "properties": {
          "evidence_ref": {
            "type": "string",
            "minLength": 1
          },
          "reason": {
            "type": "string",
            "minLength": 1,
            "maxLength": 300
          }
        }
      }
    }
  },
  "$defs": {
    "label_id": {
      "type": "string",
      "enum": [
        "house",
        "chicago_house",
        "deep_house",
        "tech_house",
        "progressive_house",
        "acid_house",
        "electro_house",
        "funky_house",
        "french_house",
        "disco_house",
        "soulful_house",
        "garage_house",
        "future_house",
        "bass_house",
        "g_house",
        "big_room_house",
        "tropical_house",
        "slap_house",
        "brazilian_bass",
        "microhouse",
        "hard_house",
        "italo_house",
        "latin_house",
        "ghetto_house",
        "jackin_house",
        "outsider_house",
        "lo_fi_house",
        "afro_house",
        "afro_tech",
        "organic_house",
        "melodic_house",
        "tribal_house",
        "techno",
        "detroit_techno",
        "minimal_techno",
        "industrial_techno",
        "acid_techno",
        "dub_techno",
        "hard_techno",
        "schranz",
        "birmingham_techno",
        "peak_time_techno",
        "raw_techno",
        "hypnotic_techno",
        "bleep_techno",
        "tribal_techno",
        "ambient_techno",
        "broken_techno",
        "melodic_techno",
        "electro",
        "electrofunk",
        "detroit_electro",
        "miami_bass",
        "electroclash",
        "baile_funk",
        "kuduro",
        "skweee",
        "trance",
        "uplifting_trance",
        "progressive_trance",
        "vocal_trance",
        "tech_trance",
        "hard_trance",
        "acid_trance",
        "dream_trance",
        "balearic_trance",
        "orchestral_uplifting",
        "psytrance",
        "goa_trance",
        "full_on_psytrance",
        "forest_dark_psytrance",
        "hi_tech_psytrance",
        "twilight_psytrance",
        "darkpsy",
        "progressive_psytrance",
        "zenonesque",
        "nitzhonot",
        "suomisaundi",
        "psybreaks",
        "drum_and_bass",
        "jungle",
        "liquid_dnb",
        "atmospheric_dnb",
        "neurofunk",
        "techstep",
        "jump_up",
        "darkstep",
        "crossbreed",
        "halftime",
        "drumfunk",
        "minimal_dnb",
        "ragga_jungle",
        "drumstep",
        "deep_dnb",
        "autonomic",
        "sambass",
        "footwork",
        "juke",
        "dubstep",
        "deep_dubstep",
        "brostep",
        "riddim",
        "melodic_dubstep",
        "tearout_dubstep",
        "140_deep_bass",
        "future_garage",
        "post_dubstep",
        "wonky",
        "chillstep",
        "grime",
        "future_bass",
        "kawaii_future_bass",
        "color_bass",
        "glitch_hop",
        "trap_edm",
        "hard_trap",
        "festival_trap",
        "hybrid_trap",
        "hyperpop",
        "digicore",
        "trapwave",
        "phonk",
        "drift_phonk",
        "memphis_phonk",
        "house_phonk",
        "brazilian_phonk",
        "midtempo",
        "midtempo_bass",
        "bouncy_midtempo",
        "cinematic_midtempo",
        "industrial_midtempo",
        "phonkstep",
        "wave",
        "breakbeat",
        "big_beat",
        "florida_breaks",
        "nu_skool_breaks",
        "dariacore",
        "progressive_breaks",
        "uk_garage",
        "2_step_garage",
        "speed_garage",
        "bassline_niche",
        "uk_funky",
        "hardcore",
        "gabber",
        "early_hardcore",
        "happy_hardcore",
        "uk_hardcore",
        "frenchcore",
        "speedcore",
        "terrorcore",
        "breakcore",
        "industrial_hardcore",
        "mainstream_hardcore",
        "hardstyle",
        "euphoric_hardstyle",
        "rawstyle",
        "xtra_raw",
        "reverse_bass",
        "nu_style_hardstyle",
        "dubstyle",
        "psystyle",
        "uptempo_hardcore",
        "moombahton",
        "reggaeton",
        "dembow",
        "moombahcore",
        "amapiano",
        "afrobeats",
        "kwaito",
        "gqom",
        "nu_disco",
        "italo_disco",
        "hi_nrg",
        "disco",
        "eurodance",
        "boogie",
        "future_funk",
        "synthwave",
        "outrun",
        "darksynth",
        "vaporwave",
        "chillwave"
      ]
    },
    "label_result": {
      "type": "object",
      "additionalProperties": false,
      "required": [
        "id",
        "confidence",
        "support",
        "evidence_refs",
        "rationale"
      ],
      "properties": {
        "id": {
          "$ref": "#/$defs/label_id"
        },
        "confidence": {
          "type": "number",
          "minimum": 0.0,
          "maximum": 1.0,
          "description": "Heuristic support score, not a calibrated probability."
        },
        "support": {
          "type": "string",
          "enum": [
            "strong",
            "moderate",
            "weak"
          ]
        },
        "evidence_refs": {
          "type": "array",
          "minItems": 1,
          "uniqueItems": true,
          "items": {
            "type": "string",
            "minLength": 1
          }
        },
        "rationale": {
          "type": "string",
          "minLength": 1,
          "maxLength": 500
        }
      }
    }
  },
  "allOf": [
    {
      "if": {
        "properties": {
          "status": {
            "const": "labeled"
          }
        },
        "required": [
          "status"
        ]
      },
      "then": {
        "properties": {
          "labels": {
            "minItems": 1
          },
          "uncertainty": {
            "type": "null"
          }
        }
      }
    },
    {
      "if": {
        "properties": {
          "status": {
            "const": "uncertain"
          }
        },
        "required": [
          "status"
        ]
      },
      "then": {
        "properties": {
          "labels": {
            "maxItems": 0
          },
          "uncertainty": {
            "type": "object"
          }
        }
      }
    },
    {
      "if": {
        "properties": {
          "status": {
            "const": "out_of_scope"
          }
        },
        "required": [
          "status"
        ]
      },
      "then": {
        "properties": {
          "labels": {
            "maxItems": 0
          },
          "candidates": {
            "maxItems": 0
          },
          "uncertainty": {
            "type": "object"
          }
        }
      }
    }
  ]
}
