{
  "schema_version": "0.1.0",
  "taxonomy_version": "0.1.0",
  "track_id": "youtube:k9wl9993ukE",
  "status": "labeled",
  "labels": [
    {
      "id": "melodic_dubstep",
      "confidence": 0.95,
      "support": "strong",
      "evidence_refs": [
        "e1",
        "e2"
      ],
      "rationale": "One source explicitly names Melodic Dubstep and an independent description matches the taxonomy emphasis on emotional/cinematic writing over dubstep structure."
    }
  ],
  "candidates": [],
  "uncertainty": null,
  "ignored_evidence": []
}
